{
  "schema_version": 2,
  "id": "sdaia-ai-engineer.project-reference.v1",
  "track_id": "sdaia-ai-engineer",
  "version": "1",
  "evidence_status": "project-reference-unverified",
  "question_count": 200,
  "section_sizes": [
    25,
    50,
    100,
    "all"
  ],
  "weights": {
    "mlops-llmops": 18,
    "data-ml": 17.3,
    "core-ai": 16.7,
    "responsible-ai-security-governance": 14.7,
    "ai-software-engineering": 14,
    "architecture-infrastructure": 12.6,
    "business-professional-practice": 6.7
  }
}
